{
  "v": 1,
  "suite": "DHKEM_X25519_HKDF_SHA256_HKDF_SHA256_CHACHA20POLY1305",
  "organization_id": "org_acme",
  "tenant_key_id": "trk_2026_08",
  "device_id": "dev_456",
  "luks_uuid": "21d4af4f-a19c-4c6a-b4e8-dd50e9f7ecb9",
  "recovery_keyslot": 1,
  "encapsulated_key": "AAAAAAAAAAAAAAAAAAAAAAAAAAAAAAAAAAAAAAAAAAA",
  "ciphertext": "AAAAAAAAAAAAAAAAAAAAAAAAAAAAAAAAAAAAAAAAAAAAAAAAAAAAAAAAAAAAAAAAAAAAAAAAAAAAAAAAAAAAAAAAAAAAAAA",
  "tag": "AAAAAAAAAAAAAAAAAAAAAA"
}
